{
  "schema_version": "1.0.0",
  "catalog_status": "metadata_complete",
  "verified_at": "2026-07-14",
  "copyright_boundary": "Contains identifiers, titles, levels, source links, and original evidence classifications. Normative criterion text is not included.",
  "sources": [
    {
      "id": "WCAG-2.2",
      "url": "https://www.w3.org/TR/WCAG22/",
      "role": "normative success-criterion metadata",
      "source_sha256": "6e3c5fe397257cae509a2fb4752b73062cf8cbeb92c2cec618989b17e4cf7057"
    },
    {
      "id": "WAIC-JIS-CHECKLIST-2020-12",
      "url": "https://waic.jp/docs/jis2016/test-guidelines/202012/gcl_example.html",
      "role": "Japanese checklist metadata",
      "source_sha256": "1228e28559f944b91b1264d0390a9fda2abbc257b38712b1a15ed8539254f1f7"
    },
    {
      "id": "DIGITAL-AGENCY-JP-PROFILE",
      "url": "https://www.digital.go.jp/accessibility-statement",
      "role": "18 additional WCAG criteria profile",
      "source_sha256": "fbe3a7f99e4d5c2444d0ecfe0227282c9ba009d5b4be9d2c2821c5860e791c18"
    }
  ],
  "catalogs": {
    "web_modern": [
      {
        "id": "WCAG-2.2-SC-1.1.1",
        "success_criterion": "1.1.1",
        "title_en": "Non-text Content",
        "level": "A",
        "introduced_in": "2.0",
        "normative_url": "https://www.w3.org/TR/WCAG22/#non-text-content",
        "understanding_url": "https://www.w3.org/WAI/WCAG22/Understanding/non-text-content.html",
        "evidence_hints": [
          "structure_inspection",
          "manual_observation"
        ],
        "method_key": "non-text-content",
        "official_method_sources": [
          "https://www.w3.org/WAI/WCAG22/Understanding/non-text-content.html",
          "https://www.w3.org/WAI/standards-guidelines/act/rules/"
        ],
        "applicability_instruction": "Determine applicability from the normative source and the scoped target; record the rationale.",
        "expectation_instruction": "Evaluate the applicable requirement against the normative source; do not infer a result from the title or an automated check alone.",
        "method_status": "profile_review_scaffold",
        "method_requirement": "manual_or_hybrid",
        "automation_role": "supporting_only",
        "normative_text_included": false
      },
      {
        "id": "WCAG-2.2-SC-1.2.1",
        "success_criterion": "1.2.1",
        "title_en": "Audio-only and Video-only (Prerecorded)",
        "level": "A",
        "introduced_in": "2.0",
        "normative_url": "https://www.w3.org/TR/WCAG22/#audio-only-and-video-only-prerecorded",
        "understanding_url": "https://www.w3.org/WAI/WCAG22/Understanding/audio-only-and-video-only-prerecorded.html",
        "evidence_hints": [
          "media_inventory",
          "caption_or_transcript_review",
          "manual_observation"
        ],
        "method_key": "time-based-media",
        "official_method_sources": [
          "https://www.w3.org/WAI/WCAG22/Understanding/audio-only-and-video-only-prerecorded.html",
          "https://www.w3.org/WAI/standards-guidelines/act/rules/"
        ],
        "applicability_instruction": "Determine applicability from the normative source and the scoped target; record the rationale.",
        "expectation_instruction": "Evaluate the applicable requirement against the normative source; do not infer a result from the title or an automated check alone.",
        "method_status": "profile_review_scaffold",
        "method_requirement": "manual_or_hybrid",
        "automation_role": "supporting_only",
        "normative_text_included": false
      },
      {
        "id": "WCAG-2.2-SC-1.2.2",
        "success_criterion": "1.2.2",
        "title_en": "Captions (Prerecorded)",
        "level": "A",
        "introduced_in": "2.0",
        "normative_url": "https://www.w3.org/TR/WCAG22/#captions-prerecorded",
        "understanding_url": "https://www.w3.org/WAI/WCAG22/Understanding/captions-prerecorded.html",
        "evidence_hints": [
          "media_inventory",
          "caption_or_transcript_review",
          "manual_observation"
        ],
        "method_key": "time-based-media",
        "official_method_sources": [
          "https://www.w3.org/WAI/WCAG22/Understanding/captions-prerecorded.html",
          "https://www.w3.org/WAI/standards-guidelines/act/rules/"
        ],
        "applicability_instruction": "Determine applicability from the normative source and the scoped target; record the rationale.",
        "expectation_instruction": "Evaluate the applicable requirement against the normative source; do not infer a result from the title or an automated check alone.",
        "method_status": "profile_review_scaffold",
        "method_requirement": "manual_or_hybrid",
        "automation_role": "supporting_only",
        "normative_text_included": false
      },
      {
        "id": "WCAG-2.2-SC-1.2.3",
        "success_criterion": "1.2.3",
        "title_en": "Audio Description or Media Alternative (Prerecorded)",
        "level": "A",
        "introduced_in": "2.0",
        "normative_url": "https://www.w3.org/TR/WCAG22/#audio-description-or-media-alternative-prerecorded",
        "understanding_url": "https://www.w3.org/WAI/WCAG22/Understanding/audio-description-or-media-alternative-prerecorded.html",
        "evidence_hints": [
          "media_inventory",
          "caption_or_transcript_review",
          "manual_observation"
        ],
        "method_key": "time-based-media",
        "official_method_sources": [
          "https://www.w3.org/WAI/WCAG22/Understanding/audio-description-or-media-alternative-prerecorded.html",
          "https://www.w3.org/WAI/standards-guidelines/act/rules/"
        ],
        "applicability_instruction": "Determine applicability from the normative source and the scoped target; record the rationale.",
        "expectation_instruction": "Evaluate the applicable requirement against the normative source; do not infer a result from the title or an automated check alone.",
        "method_status": "profile_review_scaffold",
        "method_requirement": "manual_or_hybrid",
        "automation_role": "supporting_only",
        "normative_text_included": false
      },
      {
        "id": "WCAG-2.2-SC-1.2.4",
        "success_criterion": "1.2.4",
        "title_en": "Captions (Live)",
        "level": "AA",
        "introduced_in": "2.0",
        "normative_url": "https://www.w3.org/TR/WCAG22/#captions-live",
        "understanding_url": "https://www.w3.org/WAI/WCAG22/Understanding/captions-live.html",
        "evidence_hints": [
          "media_inventory",
          "caption_or_transcript_review",
          "manual_observation"
        ],
        "method_key": "time-based-media",
        "official_method_sources": [
          "https://www.w3.org/WAI/WCAG22/Understanding/captions-live.html",
          "https://www.w3.org/WAI/standards-guidelines/act/rules/"
        ],
        "applicability_instruction": "Determine applicability from the normative source and the scoped target; record the rationale.",
        "expectation_instruction": "Evaluate the applicable requirement against the normative source; do not infer a result from the title or an automated check alone.",
        "method_status": "profile_review_scaffold",
        "method_requirement": "manual_or_hybrid",
        "automation_role": "supporting_only",
        "normative_text_included": false
      },
      {
        "id": "WCAG-2.2-SC-1.2.5",
        "success_criterion": "1.2.5",
        "title_en": "Audio Description (Prerecorded)",
        "level": "AA",
        "introduced_in": "2.0",
        "normative_url": "https://www.w3.org/TR/WCAG22/#audio-description-prerecorded",
        "understanding_url": "https://www.w3.org/WAI/WCAG22/Understanding/audio-description-prerecorded.html",
        "evidence_hints": [
          "media_inventory",
          "caption_or_transcript_review",
          "manual_observation"
        ],
        "method_key": "time-based-media",
        "official_method_sources": [
          "https://www.w3.org/WAI/WCAG22/Understanding/audio-description-prerecorded.html",
          "https://www.w3.org/WAI/standards-guidelines/act/rules/"
        ],
        "applicability_instruction": "Determine applicability from the normative source and the scoped target; record the rationale.",
        "expectation_instruction": "Evaluate the applicable requirement against the normative source; do not infer a result from the title or an automated check alone.",
        "method_status": "profile_review_scaffold",
        "method_requirement": "manual_or_hybrid",
        "automation_role": "supporting_only",
        "normative_text_included": false
      },
      {
        "id": "WCAG-2.2-SC-1.3.1",
        "success_criterion": "1.3.1",
        "title_en": "Info and Relationships",
        "level": "A",
        "introduced_in": "2.0",
        "normative_url": "https://www.w3.org/TR/WCAG22/#info-and-relationships",
        "understanding_url": "https://www.w3.org/WAI/WCAG22/Understanding/info-and-relationships.html",
        "evidence_hints": [
          "structure_inspection",
          "manual_observation"
        ],
        "method_key": "adaptable-structure",
        "official_method_sources": [
          "https://www.w3.org/WAI/WCAG22/Understanding/info-and-relationships.html",
          "https://www.w3.org/WAI/standards-guidelines/act/rules/"
        ],
        "applicability_instruction": "Determine applicability from the normative source and the scoped target; record the rationale.",
        "expectation_instruction": "Evaluate the applicable requirement against the normative source; do not infer a result from the title or an automated check alone.",
        "method_status": "profile_review_scaffold",
        "method_requirement": "manual_or_hybrid",
        "automation_role": "supporting_only",
        "normative_text_included": false
      },
      {
        "id": "WCAG-2.2-SC-1.3.2",